{
  "findings": [],
  "layers":
  {
    "relax_ng":
    {
      "message": "Validated against ODD-derived project Relax NG target.",
      "status": "passed",
      "validator": "jing"
    },
    "schematron":
    {
      "message": "No project Schematron findings.",
      "status": "passed",
      "validator": "abc.tools.schematron"
    },
    "well_formed_xml":
    {
      "message": "Generated by clojure.data.xml.",
      "status": "passed",
      "validator": "clojure.data.xml"
    }
  },
  "status": "passed",
  "tei_profile_hash": "sha256:cc6e2c5c740c0a210e1a7081fda3276559099e3fd54f0d0e4c62746867b1b8c8",
  "toolchain":
  {
    "generator": null,
    "generator_build_hash": null,
    "odd_hash": "sha256:cc6e2c5c740c0a210e1a7081fda3276559099e3fd54f0d0e4c62746867b1b8c8",
    "odd_path": "schemas\/tei-profile.odd",
    "rng_hash": "sha256:debcae124a024baa5a1c85f5377bb6e3172df84cef91de3d8202bd65a94066f4",
    "rng_path": "schemas\/tei-profile.rng",
    "schematron_hash": "sha256:b8cf73c5c2267e97d6ae041ea68012626551ddff0fb2205838418b06d6513113",
    "schematron_path": "schemas\/tei-profile.sch"
  },
  "validated_artifact": "sha256:9f4cda7188f68ebcc39b900904eaf6ca660e8182604585ce304c42173def21f4"
}
